{
  "schema_version": "1.0.0",
  "registry_id": "mar-experiment-registry-v1",
  "project": "Memória Audiovisual em Rede",
  "scope": "scientific experiments, calibration, blind validation and diagnostics performed during T2A operational validation",
  "updated_on": "2026-09-15",
  "does_not_modify_official_baseline": true,
  "governance_document": "docs/research/13_experiment_registry.md",
  "experiments": [
    {
      "experiment_id": "MAR-T2A-C1-TERM-001",
      "version": "1",
      "stage": "ai_content_gate1_terminology_validation",
      "scientific_layer": "ai_in_audiovisual_content",
      "experiment_types": [
        "controlled_benchmark",
        "blind_human_validation",
        "calibration_experiment"
      ],
      "decision_date": "2026-08-18",
      "status": "validated_for_current_protocol_scope",
      "claim_level": "protocol_scope",
      "is_prevalence_sample": false,
      "does_not_modify_official_baseline": true,
      "question": "Can the current deterministic Gate 1 protocol identify terminology and context indicating AI participation in audiovisual production or modification without converting that signal into archive-level AI evidence?",
      "sample_summary": {
        "controlled_reference_benchmark": {
          "controls": 6,
          "positive_controls": 3,
          "negative_controls": 3,
          "binary_false_positive": 0,
          "binary_false_negative": 0,
          "exact_class_accuracy": 1
        },
        "blind_real_corpus_negative_challenge": {
          "units": 12,
          "human_negative": 12,
          "true_negative": 12,
          "false_positive": 0
        },
        "supplementary_positive_terminology_controls": {
          "human_reviewed_total": 6,
          "human_evaluable": 4,
          "human_positive": 4,
          "human_not_assessable": 2
        }
      },
      "blinding": {
        "human_reviewer_saw_model_predictions": false
      },
      "protocol_deviations": [
        {
          "deviation_id": "blind_predictions_materialized_after_human_review",
          "severity": "historical_protocol_limitation",
          "description": "The negative-challenge prediction artifact was materialized after the human blind review and is not treated as a preregistered empirical blind-performance estimate."
        }
      ],
      "scientific_use": "calibrated terminology/context candidate generation for Gate 2 only",
      "limitations": [
        "The real-corpus blind challenge contained only human-negative cases and cannot estimate positive recall.",
        "The blind prediction set for the negative challenge was materialized after human review rather than frozen before review.",
        "Controlled benchmarks do not estimate corpus-wide prevalence or generalisation."
      ],
      "prohibited_interpretations": [
        "does not validate AI presence in an observed archive",
        "does not estimate prevalence",
        "does not bypass Gate 2 item-level, corpus-membership, public-access and item-linked-evidence requirements"
      ],
      "artifacts": [
        {
          "path": "data/digital_infrastructure/ai_experiments/ai_content_validation_report_v1.json",
          "role": "controlled_benchmark_report",
          "content_sha": "7af6b43f5b800119dc1c54bf044199caa9b52b44"
        },
        {
          "path": "data/digital_infrastructure/ai_experiments/ai_content_blind_review_queue_v1.json",
          "role": "human_review_queue",
          "content_sha": "7017094378ab0fc0570545f8c6c474e2813837cc"
        },
        {
          "path": "data/digital_infrastructure/ai_experiments/ai_content_blind_predictions_v1.json",
          "role": "blind_prediction_set_materialized_after_human_review",
          "content_sha": "3bc98ecdd4b96d53d97b3930932ea71e7b761922",
          "frozen_before_human_review": false
        },
        {
          "path": "data/digital_infrastructure/ai_experiments/ai_content_blind_comparison_report_v1.json",
          "role": "blind_negative_challenge_comparison",
          "content_sha": "a84dc1fc65229c3dd7b534e353a801ca3995397b"
        },
        {
          "path": "data/digital_infrastructure/ai_experiments/ai_content_gate1_terminology_validation_conclusion_v1.json",
          "role": "scientific_conclusion",
          "content_sha": "c7f1a8857ab1ab27599ef9f196c2cbc908a0ba64"
        },
        {
          "path": "docs/research/experiments/2026-08_c1_gate1_terminology_validation_v1.md",
          "role": "human_readable_experiment_report"
        }
      ]
    },
    {
      "experiment_id": "MAR-T2A-C2-M4-PILOT-001",
      "version": "1",
      "stage": "t2a_ai_archive_gate2_validation",
      "scientific_layer": "ai_in_audiovisual_content",
      "experiment_types": [
        "operational_pilot",
        "calibration_experiment"
      ],
      "status": "completed_calibration_finding",
      "claim_level": "calibration_only",
      "is_prevalence_sample": false,
      "does_not_modify_official_baseline": true,
      "question": "Do candidate URLs entering Gate 2 represent eligible audiovisual item, version or segment observations before later corpus-membership, public-access and evidence-link checks?",
      "sample_summary": {
        "candidates_total": 2,
        "entities": [
          "ecpad",
          "ina"
        ],
        "human_item_level_eligible": 0,
        "human_item_level_ineligible": 2
      },
      "result_scope": "Only Gate 2 condition 1 / M4 item-level eligibility was reached because both candidates failed at that first condition.",
      "protocol_deviations": [
        {
          "deviation_id": "original_review_queue_not_closed",
          "severity": "documentation_and_provenance_gap",
          "description": "The human finding was completed but the original machine-readable queue remained pending; a retrospective conclusion preserves the result without overwriting the historical queue."
        },
        {
          "deviation_id": "original_human_review_date_not_preserved",
          "severity": "metadata_gap",
          "description": "The exact original human-review completion date was not preserved in a dedicated source artifact."
        }
      ],
      "scientific_decision": "Treat the 0/2 result as a candidate-resolution limitation and prioritise M3/M4 surface and item resolution before repeating Gate 2 at scale.",
      "limitations": [
        "The sample contained only two candidates and was not designed to estimate prevalence or generalisation.",
        "Only Gate 2 condition 1 / M4 item-level eligibility was reached.",
        "The original review queue was not closed with the final human decisions."
      ],
      "prohibited_interpretations": [
        "does not indicate absence of AI",
        "does not indicate absence of audiovisual archives",
        "does not estimate prevalence",
        "does not evaluate all Gate 2 conditions"
      ],
      "artifacts": [
        {
          "path": "data/digital_infrastructure/ai_experiments/ai_archive_two_gate_review_queue_v1.json",
          "role": "original_blind_review_queue_left_pending",
          "content_sha": "0df9b507e3173a7428b2906395c6617c36ff5be3"
        },
        {
          "path": "data/digital_infrastructure/ai_experiments/ai_archive_two_gate_pilot_conclusion_v1.json",
          "role": "retrospective_durable_conclusion",
          "content_sha": "16ff14eb96de4aad095911b23efb04165e39e6ed",
          "retrospective_documentation": true
        },
        {
          "path": "docs/research/experiments/2026-08_c2_m4_gate2_candidate_pilot_v1.md",
          "role": "human_readable_experiment_report"
        }
      ]
    },
    {
      "experiment_id": "MAR-T2A-M3-BLIND-001",
      "version": "1",
      "stage": "t2a_mar_surface_typing_validation",
      "scientific_layer": "mar_intelligence_automation",
      "experiment_types": [
        "blind_human_validation",
        "calibration_experiment"
      ],
      "sample_observed_on": "2026-08-19",
      "human_review_completed_on": "2026-08-24",
      "status": "completed_calibration_only",
      "claim_level": "calibration_only",
      "is_prevalence_sample": false,
      "does_not_modify_official_baseline": true,
      "question": "Can M3 distinguish public-surface roles and item-level audiovisual units from general, institutional, archive, search/index and editorial surfaces?",
      "sample_summary": {
        "units_total": 17,
        "entities": [
          "archipop",
          "bfi",
          "ecpad",
          "europeana",
          "ina"
        ],
        "human_item_level_true": 4,
        "human_item_level_false": 13,
        "human_unknown": 0,
        "human_surface_type_counts": {
          "homepage": 3,
          "institutional_landing_page": 1,
          "archive_landing_page": 1,
          "search_or_index": 7,
          "news_or_editorial": 1,
          "item_record": 0,
          "audiovisual_item": 4,
          "restricted_or_unavailable": 0,
          "unknown": 0
        }
      },
      "blinding": {
        "human_reviewer_saw_model_predictions": false,
        "human_review_closed_before_diagnostic_replay": true
      },
      "source_execution": {
        "workflow_name": "Quality Checks",
        "workflow_run_id": 32291088792,
        "job_id": 96191802582,
        "probe_id": "M3_LIVE_BLIND_QUEUE_V1",
        "run_id": "m3-live-probe-v1"
      },
      "protocol_deviations": [
        {
          "deviation_id": "missing_frozen_prediction_artifact",
          "severity": "invalidates_original_performance_estimation",
          "description": "The live probe computed automatic predictions in runner memory but did not persist a frozen prediction artifact for the exact 17-unit run."
        },
        {
          "deviation_id": "legacy_queue_partially_annotated_after_initial_persistence",
          "severity": "record_separation_issue_without_prediction_unblinding",